{
  "version": 2,
  "eventType": "purchase.registered",
  "payloadVersion": 2,
  "eventId": "33333333-3333-4333-8333-333333333333",
  "accountId": "11111111-1111-4111-8111-111111111111",
  "deviceId": "22222222-2222-4222-8222-222222222222",
  "deviceSequence": 1,
  "occurrenceTime": "2026-07-12T12:30:00.000Z",
  "queueState": "pending",
  "requiredPayloadFields": [
    "id",
    "accountId",
    "store",
    "occurrenceTime",
    "currencyCode",
    "items"
  ]
}
